id,submission_time,vote_number,question_id,message,image
qzbp,1555504359,0,0,"You can either cast, create, summon, wait for it to happen, or shit a new one.",https://cdncontribute.geeksforgeeks.org/wp-content/uploads/List-Slicing.jpg
hpcu,1555499485,0,afdo,this is an answer to proba viagra 2,https://www.canadasgardenroute.ca/img/cache/391/911/13/97497209072078341312-0906755001529592725.jpg
cgad,1555427100,0,2,This is not a question.,wat.jpg
xwsz,1555420844,5,0,safddsafdsafdsafdsafdsafdsafdsaf,
wvhs,1555420836,-4,0,FFSDAADSFFDSAFSADFDSAF,
yokp,1555417302,3,0,98765456789hnzfbfb,
0,1493398154,6,0,You need to use brackets: my_list = [],
1,1493088154,35,0,Look it up in the Python docs,
